{
  "schema_version": "quality-gate-benchmark.v1",
  "suite_id": "source-to-master-core",
  "version": 1,
  "frozen": true,
  "thresholds": {
    "min_precision": 1,
    "min_recall": 1,
    "min_f1": 1,
    "min_blocking_recall": 1
  },
  "cases": [
    {
      "case_id": "positive-complete-chain",
      "kind": "positive",
      "description": "A complete eight-layer chain with stable character state and no unsupported defects.",
      "snapshot": {
        "schema_version": "cross-layer-quality-gate.v1",
        "project_id": "benchmark_project",
        "episode_id": "episode_positive",
        "master_id": "master_positive",
        "duration_ms": 10000,
        "artifacts": [
          {"stage": "source_ir", "artifact_id": "source_positive", "version": 1, "duration_ms": 10000},
          {"stage": "adaptation_plan", "artifact_id": "plan_positive", "version": 1, "duration_ms": 10000},
          {"stage": "episode_outline", "artifact_id": "outline_positive", "version": 1, "duration_ms": 10000},
          {"stage": "script", "artifact_id": "script_positive", "version": 1, "duration_ms": 10000},
          {"stage": "storyboard", "artifact_id": "storyboard_positive", "version": 1, "duration_ms": 10000},
          {"stage": "media", "artifact_id": "media_positive", "version": 1, "duration_ms": 10000},
          {"stage": "edit_timeline", "artifact_id": "timeline_positive", "version": 1, "duration_ms": 10000, "timeline": [{"timeline_item_id": "video_positive", "track_type": "video", "entity_type": "shot", "entity_id": "shot_positive", "start_ms": 0, "end_ms": 10000}, {"timeline_item_id": "audio_positive", "track_type": "audio", "entity_type": "audio", "entity_id": "audio_positive", "start_ms": 0, "end_ms": 10000}]},
          {"stage": "master", "artifact_id": "master_positive", "version": 1, "duration_ms": 10000}
        ]
      },
      "expected_codes": [],
      "forbidden_codes": ["REQUIRED_LAYER_MISSING", "CRITICAL_FACT_CHANGED", "QUALITY_GATE_BLOCKED"]
    },
    {
      "case_id": "negative-cross-layer-corruption",
      "kind": "negative",
      "description": "A critical fact is changed; dialogue conflicts with the picture; identities drift; the edit exceeds master bounds.",
      "snapshot": {
        "schema_version": "cross-layer-quality-gate.v1",
        "project_id": "benchmark_project",
        "episode_id": "episode_negative",
        "master_id": "master_negative",
        "duration_ms": 10000,
        "artifacts": [
          {"stage": "source_ir", "artifact_id": "source_negative", "version": 1, "duration_ms": 10000, "facts": [{"key": "killer", "value": "uncle", "critical": true, "source_span_id": "span_7", "quote": "the uncle held the knife", "required_stages": ["adaptation_plan"]}]},
          {"stage": "adaptation_plan", "artifact_id": "plan_negative", "version": 1, "duration_ms": 10000, "facts": [{"key": "killer", "value": "butler", "critical": false}]},
          {"stage": "episode_outline", "artifact_id": "outline_negative", "version": 1, "duration_ms": 10000},
          {"stage": "script", "artifact_id": "script_negative", "version": 1, "duration_ms": 10000},
          {"stage": "storyboard", "artifact_id": "storyboard_negative", "version": 1, "duration_ms": 10000},
          {"stage": "media", "artifact_id": "media_negative", "version": 1, "duration_ms": 10000},
          {"stage": "edit_timeline", "artifact_id": "timeline_negative", "version": 1, "duration_ms": 10000, "timeline": [{"timeline_item_id": "video_edit_negative", "track_type": "video", "entity_type": "shot", "entity_id": "shot_edit_negative", "start_ms": 0, "end_ms": 10000}, {"timeline_item_id": "audio_edit_negative", "track_type": "audio", "entity_type": "audio", "entity_id": "audio_edit_negative", "start_ms": 0, "end_ms": 10000}]},
          {"stage": "master", "artifact_id": "master_negative", "version": 1, "duration_ms": 10000,
            "av_bindings": [{
              "binding_id": "av_negative", "dialogue_id": "dialogue_negative", "shot_id": "shot_negative",
              "start_ms": 1000, "end_ms": 2000,
              "speaker_character_id": "lin", "subtitle_character_id": "mei", "lip_character_id": "mei",
              "visible_character_ids": ["mei"], "dialogue_text": "the door is locked", "subtitle_text": "the door is open",
              "spoken_assertions": {"door": "locked"}, "visual_assertions": {"door": "open"}
            }],
            "timeline": [{"timeline_item_id": "video_negative", "track_type": "video", "entity_type": "shot", "entity_id": "shot_negative", "start_ms": 0, "end_ms": 11000}]
          }
        ]
      },
      "expected_codes": [
        "CRITICAL_FACT_CHANGED", "DIALOGUE_VISUAL_CONTRADICTION", "SPEAKER_SUBTITLE_IDENTITY_MISMATCH",
        "VOICE_LIP_IDENTITY_MISMATCH", "SPEAKER_NOT_VISIBLE", "VOICE_SUBTITLE_TEXT_MISMATCH",
        "TIMELINE_ITEM_OUT_OF_BOUNDS", "SILENCE_GAP"
      ],
      "expected_blocking_codes": [
        "CRITICAL_FACT_CHANGED", "DIALOGUE_VISUAL_CONTRADICTION", "SPEAKER_SUBTITLE_IDENTITY_MISMATCH",
        "VOICE_LIP_IDENTITY_MISMATCH", "TIMELINE_ITEM_OUT_OF_BOUNDS", "SILENCE_GAP"
      ]
    },
    {
      "case_id": "negative-narrative-and-constraint-breaks",
      "kind": "negative",
      "description": "Character state jumps, causality and action coverage break, foreshadowing and hooks fail, reveals overload, and a continuity constraint is violated.",
      "snapshot": {
        "schema_version": "cross-layer-quality-gate.v1",
        "project_id": "benchmark_project",
        "episode_id": "episode_narrative_negative",
        "master_id": "master_narrative_negative",
        "duration_ms": 10000,
        "artifacts": [
          {"stage": "source_ir", "artifact_id": "source_narrative_negative", "version": 1, "duration_ms": 10000},
          {"stage": "adaptation_plan", "artifact_id": "plan_narrative_negative", "version": 1, "duration_ms": 10000, "characters": [{"character_id": "lin", "goal": "find truth", "motivation": "save family"}]},
          {"stage": "episode_outline", "artifact_id": "outline_narrative_negative", "version": 1, "duration_ms": 10000, "characters": [{"character_id": "lin", "goal": "flee town", "motivation": "save family"}]},
          {"stage": "script", "artifact_id": "script_narrative_negative", "version": 1, "duration_ms": 10000, "events": [{"event_id": "effect_without_cause", "order": 1, "cause_ids": ["missing_cause"], "description": "the vault opens"}], "actions": [{"action_id": "required_door_action", "description": "Lin opens the sealed door", "required": true}]},
          {"stage": "storyboard", "artifact_id": "storyboard_narrative_negative", "version": 1, "duration_ms": 10000},
          {"stage": "media", "artifact_id": "media_narrative_negative", "version": 1, "duration_ms": 10000, "constraints": [{"constraint_id": "continuity_costume", "kind": "continuity", "reference_id": "ledger_costume_v1", "compliant": false, "severity": "blocking", "observed": "red coat", "expected": "black coat"}]},
          {"stage": "edit_timeline", "artifact_id": "timeline_narrative_negative", "version": 1, "duration_ms": 10000, "timeline": [{"timeline_item_id": "video_narrative", "track_type": "video", "entity_type": "shot", "entity_id": "shot_narrative", "start_ms": 0, "end_ms": 10000}, {"timeline_item_id": "audio_narrative", "track_type": "audio", "entity_type": "audio", "entity_id": "audio_narrative", "start_ms": 0, "end_ms": 10000}]},
          {"stage": "master", "artifact_id": "master_narrative_negative", "version": 1, "duration_ms": 10000,
            "foreshadows": [{"thread_id": "secret", "kind": "revealed", "time_ms": 100}, {"thread_id": "secret", "kind": "planted", "time_ms": 500}],
            "hooks": [{"hook_id": "opening_late", "kind": "opening_3s", "time_ms": 5000, "content": "late opening"}],
            "reveals": [{"reveal_id": "r1", "key": "identity", "time_ms": 1000, "content": "identity"}, {"reveal_id": "r2", "key": "identity", "time_ms": 2000, "content": "identity again"}, {"reveal_id": "r3", "key": "motive", "time_ms": 3000, "content": "motive"}, {"reveal_id": "r4", "key": "weapon", "time_ms": 4000, "content": "weapon"}, {"reveal_id": "r5", "key": "location", "time_ms": 5000, "content": "location"}]
          }
        ]
      },
      "expected_codes": [
        "CHARACTER_STATE_DISCONTINUITY", "CAUSE_MISSING", "FORESHADOW_EARLY_REVEAL",
        "FORESHADOW_UNRESOLVED", "HOOK_OUTSIDE_WINDOW", "REVEAL_REPEATED", "REVEAL_OVERLOAD",
        "SCRIPT_ACTION_NOT_COVERED", "CONSTRAINT_VIOLATION"
      ],
      "expected_blocking_codes": [
        "CAUSE_MISSING", "FORESHADOW_EARLY_REVEAL", "FORESHADOW_UNRESOLVED",
        "HOOK_OUTSIDE_WINDOW", "SCRIPT_ACTION_NOT_COVERED", "CONSTRAINT_VIOLATION"
      ]
    }
  ]
}
